Title,Upvotes,Post ID,URL,Text,Comment Count,Posted Date,sentiment
megathread discus main game spoiler,3,1jfjvnx,https://www.reddit.com/r/AssassinsCreedShadows/comments/1jfjvnx/megathread_discuss_main_game_spoilers_here/,hello everyone megathread dedicated discussing spoiler main game freely talk main story side quest world event modern day segment lore aspect main game rule tag spoiler related endgame quest content briefly specify spoiler without spoiling anything player may speed story others like take time exploring ask mindful respectful everyone experience assassin creed shadow cover art hide spoiler hide spoiler surround spoiler text beginning end example big spoiler result big spoiler leave space start end also use spoiler function reddits text editor thank understanding rassassinscreedshadows mod team,19,2025-03-20 08:03:22,1.0
hideout flair added subreddit,7,1ji3l37,https://www.reddit.com/r/AssassinsCreedShadows/comments/1ji3l37/hideout_flair_added_to_the_subreddit/,hello everyone requested user added hideout flair feel free use share hideout rassassinscreedshadows mod team,0,2025-03-23 16:45:35,1.0
time hater clam face reality,353,1jiz43s,https://i.redd.it/87ryazg2toqe1.jpeg,amazing game people enjoy playing stop trying tell people stop fun really hate much stop talking go play whatever think woke basement leave game alone cuz good,297,2025-03-24 19:14:43,1.0
til hour customize individual part weapon,213,1jiynbl,https://v.redd.it/0zucu7ohpoqe1,yeah idea possible hr playing found feel stupid,55,2025-03-24 18:56:29,0.0
pretty,127,1jixnuo,https://i.redd.it/rtqp3uqyioqe1.jpeg,face card gorgeous,24,2025-03-24 18:18:03,1.0
assassin creed shadow ubisoft secondbiggest launch date behind assassin creed valhalla,118,1jixkbu,https://insider-gaming.com/assassins-creed-shadows-launch/,according insider gaming source provided data last three mainline assassin creed title information tweeted public formerly twitter account hour ago according source obtained information via ubisoft tracking tool provided data past title show assassin creed shadow behind valhalla ahead odyssey last week ubisoft announced assassin creed shadow past two million player two day launch one million player one day launch according data assassin creed valhalla achieved million player first day whereas odyssey achieved shy roughly early access time writing march shadow tracking hit three million player coming day according trajectory shadow could hit roughly six million player within first month worth pointing game released compared successful assassin creed game release holiday season assassin creed valhalla first month whereas odyssey million time writing odyssey currently unique player assassin creed title sitting million always pointed online player number sale game performance ubisoft coming month,25,2025-03-24 18:14:11,1.0
one glitch far kind biggie,427,1jinhjr,https://www.reddit.com/gallery/1jinhjr,giant villager mukp normal size til killed nearby ronin became huge like look like petting naue nd shot moment thought supposed animus glitched entity per weekly gotten see yet nothing special eagle vision animus artifact,43,2025-03-24 10:28:01,0.0
make sad,144,1jit6pb,https://www.reddit.com/r/AssassinsCreedShadows/comments/1jit6pb/this_makes_me_sad/,always guy opinion never cared people said game movie etc liked enjoyed love game first preview first second love starting realize hate game still going starting get make angry get bad mood understand people think way want go detail kind hate getting sure heard least people like asmondgold drive crazy embarrassed feel way video game loving game want love even exploring replay course hate really getting nerve seem escape guy thinking kind sad like said,287,2025-03-24 15:19:51,1.0
game look good,51,1jj0iew,https://i.redd.it/jgsi1g9t2pqe1.jpeg,ubi really good job time look stunning run incredibly well probs devs,3,2025-03-24 20:09:18,1.0
saw others sharing hideout wanted show mine,45,1jix1yv,https://www.reddit.com/gallery/1jix1yv,max level put probably hour designing still probably good think whatever proud italso yes screen shot photo mode hate,15,2025-03-24 17:54:51,1.0
really hope update game often valhalla,23,1jj2mnz,https://www.reddit.com/r/AssassinsCreedShadows/comments/1jj2mnz/i_really_hope_they_update_this_game_as_often_as/,ubisoft added lot cool qol feature mechanic weapon event etc wvalhalla everything hit sheer amount content staggering hope attention poured shadow much potential already wait bo staff would love weapon armor engraving enemy kill animation parkour adjustment like mirage legacy outfit new tool maybe like trap like mirage want see coming back game throughout life cycle,4,2025-03-24 21:33:28,1.0
hideki kamiya creator viewtifuo joe devil may cry bayonetta director resident evil comment shadow see translation picture,84,1jipzgu,https://www.reddit.com/gallery/1jipzgu,translation felt bad criticized much glad seems well sale review,7,2025-03-24 12:55:37,0.0
time yasuke,148,1jimx4q,https://www.reddit.com/r/AssassinsCreedShadows/comments/1jimx4q/a_time_before_yasuke/,hr beginning get bit perturbed still reached point could play yasuke sight seeing playing side contentgoodie getting time decided progress main story behold hour finally running around mortal abrams tank hour yasuke grew appreciate time gap character feel like ubi great job letting reach level comfort naoe completely spice life yasuke handleplay differently also plethora little detail set two character apart get specific keep eye may pleasantly surprised thank developer work going unnoticed,43,2025-03-24 09:47:28,1.0
game one first game generation feel next gen,969,1jicmip,https://www.reddit.com/gallery/1jicmip,game breath taking ubisoft cooked game,258,2025-03-23 23:12:53,0.0
cried process emotion right,276,1jijxvd,https://www.reddit.com/r/AssassinsCreedShadows/comments/1jijxvd/i_cried_i_cant_process_my_emotions_right_now/,collecting ac collector edition whole life turning year eek breakup year ago unfaithful partner left homeless lost figurine proudly displayed ac shadow return collection although one brought genuine tear emotion receive absolutely beautiful treasure although waiting list home parent need anybody worry wait display finally find somewhere installed game played first five minute cry astonishing game graphic music combat story character wow edit add since moved much happier independent lot,46,2025-03-24 05:55:26,1.0
bot leaving copy pasted review,73,1jiq5ua,https://www.reddit.com/gallery/1jiq5ua,also look account inactive reviewed game stuff say even straight true,139,2025-03-24 13:04:23,1.0
combat tanky meanwhile,11,1jj47wj,https://v.redd.it/01g1d58htpqe1,skill tree tanto back vulnerable attack knowledge shnobi deflect flip knowledge,1,2025-03-24 22:39:45,0.0
thank ubisoft making feel like kid,35,1jitfyg,https://www.reddit.com/r/AssassinsCreedShadows/comments/1jitfyg/thank_you_ubisoft_for_making_me_feel_like_a_kid/,seventeen year ago today got first assassin creed ninth birthday dad let play liked history growing playing shadow made feel like little kid experiencing franchise made gamer wanted say thank ubisoft reminding little boy fell love franchise entire dev team let hate get still people like love franchise matter,3,2025-03-24 15:30:35,1.0
naoes japanese va appreciation post,24,1jiu5to,https://www.reddit.com/r/AssassinsCreedShadows/comments/1jiu5to/naoes_japanese_va_appreciation_post/,basically title emotion put voice talking father main villain awardworthy love adorable yatta finish little painting animal thru game even played english audio wanted throw love naoes japanese va great job,11,2025-03-24 15:59:59,1.0
kitten around,156,1jij9i1,https://www.reddit.com/gallery/1jij9i1,still unlocked yasuke happy taking time smell rose anyone else taking seriously finding time silly thing,7,2025-03-24 05:07:53,1.0
thought hater,630,1jia17r,https://v.redd.it/neo5cp75aiqe1,figured would appreciate,196,2025-03-23 21:17:59,1.0
get colour selector sticker,10,1jj0rtp,https://i.redd.it/0v4w2klk4pqe1.png,wanted make text black stand little unless dribbling idiot see option change colour literally unplayable,3,2025-03-24 20:19:10,0.0
hour killed main target,13,1jiwnsw,https://www.reddit.com/r/AssassinsCreedShadows/comments/1jiwnsw/im_25_hours_in_and_have_only_killed_3_main_targets/,side stuff game incredible,9,2025-03-24 17:39:29,0.0
hideout system favorite part game,10,1jiz3ka,https://www.reddit.com/gallery/1jiz3ka,spent hour chipping away hideout still done want add stepping stone create path particularly gravel found yet satisfied thus far,2,2025-03-24 19:14:07,1.0
,4,1jj5opn,https://i.redd.it/wcwww6wq4qqe1.jpeg,alternating loving also still playing avowed kingdom come deliverance trying compare anything saying fun playing around else ya playing anything,0,2025-03-24 23:41:56,1.0
item limit pet mean want puppy kitten,6,1jj27uj,https://www.reddit.com/gallery/1jj27uj,hideout system great spending lot time make feel like home tried make realistic symetric perfect design love inperfection thing anyway wanted lot kitten cat come error tried different type pet still error could able put many item without restriction suck remove kind animal,1,2025-03-24 21:16:48,1.0
camera fov need addressed traversing hill nightmare,19,1jism0n,https://www.reddit.com/gallery/1jism0n,traversing hill nightmare camera far narrow low fov still far narrow previous game ridiculously narrow need adjusting option attached example think look understand performance hit many instance feeling awkward feel way previous game even fov need little higher head centre camera,13,2025-03-24 14:56:40,0.0
first picturedrop,8,1jj06my,https://www.reddit.com/gallery/1jj06my,love new game take time damn sometimes want stop admire scenery,2,2025-03-24 19:56:55,1.0
thought opinion,18,1jirz6x,https://www.reddit.com/r/AssassinsCreedShadows/comments/1jirz6x/my_thoughts_opinions/,express moon game majority hate people believe even played game part band wagon hate game reason opinion game amazing playing p pro performance wise graphic wise phenomenal fault absolutely love scenery almost every viewpoint think massive step compared previous title mission feel pointless like idea yasuke well story gripping hypnotised cutscenes honestly love parkour well smooth along little flip kick make much better fact play player every mission almost fact every mission strategic point make really fun replay able game spend hour hideout messing design moving swapping changing feature unlock honestly still much game feel like av playing forever even bad sense still wanting chapter still hr honestly need rush game enjoy taking time fact almost every pinpoint map rewarding make game whole lot better explore enjoy shadow keep light rain justice upon japan enjoy fellow assassin p platinum trophy hunter anyone wanting maybe compare play future game add psn nathanhezz,21,2025-03-24 14:29:28,1.0
loving game control nightmare,3,1jj5oti,https://www.reddit.com/r/AssassinsCreedShadows/comments/1jj5oti/i_am_loving_this_game_but_the_controls_are_a/,life find control scheme controller feel good looked many post suggestion one way another functionality lost using default control crazy reason hard coded opening ability wheel even though one needed configurable addition fact select keybinds able changed press hold double tap hard coding interferes many type input really want control scheme scuffed square light attack triangle heavy attack sprint either eagle vision stick press force hold button basically impossible without sacrificing gameplay feature whether quick throw working yasukes sheath attack sprinting crouch sprint manually leave crouch order sprint crouching sprint sliding parkour working sprint interact working placed rr due hard coding etc amazing game shit incredibly frustrating,1,2025-03-24 23:42:04,0.0
enjoy walking game much scenery pretty,3,1jj5iwi,https://youtu.be/1vohIz4Zl0w?si=96x8ekO_44xtPyDo,calming walk around enjoy view,0,2025-03-24 23:35:01,1.0
never realised slt gold,6,1jiy9dq,https://www.reddit.com/r/AssassinsCreedShadows/comments/1jiy9dq/i_never_realised_i_was_such_a_slt_for_gold/,mate go setting nice little mission set gearwise ready stealth kill everything everyone happens see gold circle distance lovely shiny consuming gold circle must honestly resist turn gollum precious even fortress way current level sneak snoop slide anything else beginning even die many time get lovely yummy gold circle anyone else,2,2025-03-24 18:41:28,1.0
ac shadow,3,1jj51e0,https://i.redd.it/d5evt80tzpqe1.jpeg,please crucify comment unsure feel shadow say like stopped playing since release say love either anyone else know getting crazy also fun little question replace naoe tool something else would mine would swapping kunai kind blow dart would accurate think fun,0,2025-03-24 23:14:14,1.0
something missed odyssey,4,1jj1ze4,https://www.reddit.com/r/AssassinsCreedShadows/comments/1jj1ze4/something_i_missed_from_odyssey/,spoiler tag case vague possible killed random guy random castle prompted whole new organization uncover marker anything led guy exploration odyssey something similar could kill person happened main target valhalla away forced uncover clue yes even already knew exactly target spawned glad see changed,1,2025-03-24 21:07:04,0.0
yasuke appreciation post,11,1jitamy,https://www.reddit.com/r/AssassinsCreedShadows/comments/1jitamy/yasuke_appreciation_post/,man genuinely love character fun video game long time he actually beast fun blow door kick people foot actually tell love playing naoe game hella fun,8,2025-03-24 15:24:19,1.0
looking butterfly,3,1jj3ve3,https://www.reddit.com/r/AssassinsCreedShadows/comments/1jj3ve3/looking_for_butterflies/,running around osaka looking th butterfly long sat next lady whose house burned cry,2,2025-03-24 22:25:06,0.0
,344,1ji952l,https://v.redd.it/nuxbgdq73iqe1,game amazing slowly growing loving ubisoft thing,34,2025-03-23 20:39:28,1.0
psa attack enemy vulnerable yellow highlight light posture attack weak point strike,27,1jin4ty,https://www.reddit.com/r/AssassinsCreedShadows/comments/1jin4ty/psa_attack_enemies_in_vulnerable_yellow_highlight/,found video youtube explained vulnerable weak point worked made realize wrong game explains poorly manage make opponent vulnerable either perfect dodge perfect parry skill applies vulnerable need perform light posture attack want trigger weak point strike weak point strike performs weapon specific animation different usual light posture attack damage depending equipement engraving also trigger nice additional effect attack light posture attack heavy light skill ranged trigger weak point strike far know according test performed yesterday,8,2025-03-24 10:03:00,0.0
played hour far used quick travel time anyone else boat,9,1jiuqro,https://www.reddit.com/gallery/1jiuqro,world make want never use fast travel nice roam around game world dense well crafted well layed honestly breathtaking beautiful game playing pc tv always would rather travel foot horse quick travel destination world always feel dynamic ever changing feel like exact location love,2,2025-03-24 16:23:08,1.0
ac shadow good hater pissed,2,1jj6aod,https://www.reddit.com/r/AssassinsCreedShadows/comments/1jj6aod/ac_shadows_is_doing_good_and_haters_are_pissed/,realized seen big fuzz comparing got ac game dropped release one main discussion community none today issue surround ubisoft company long credit scene way absurd hate discussion found thing heard negative game dropped today,0,2025-03-25 00:09:46,0.0
devs showed respect mass medium lied,4,1jj0v0f,https://www.reddit.com/r/AssassinsCreedShadows/comments/1jj0v0f/devs_showed_respect_mass_media_lied/,enough people talking thr small detail like boot come indoor shelter enter japan also try shrine approach pray even hand motion spot japanese pray shrine think super funny people continue lie hate ubisoft,4,2025-03-24 20:22:36,1.0
return living dead going,4,1jj0gvz,https://v.redd.it/e67u8evi2pqe1,trying clear contract camp happened game cracking,2,2025-03-24 20:07:46,1.0
thank message assassin creed shadow development team,780,1ji1npx,https://www.reddit.com/r/assassinscreed/s/cMox9EJ4Jt,hello everyone weekend many u dev team spent time reading reaction across assassin creed subreddit want say thank sheer amount love positivity received incredibly heartwarming came across post particular wredditcomrassassinscreedcomments jhpbax thankyoutotheassassinscreedshadowste really moved u seeing excitement thoughtful reaction joy meant world u year hard work nothing rewarding watching community connect created reply directly please know listening entire devteam reading post celebration feedback theory inspiring fuel u help u keep improving thank part journey u beginnig shadow thrilled see game evolve side men blindly follow truth remember nothing true assassin creed shadow dev team,147,2025-03-23 15:21:22,1.0
love game,4,1jj2l3v,https://i.redd.it/mfe9y7chhpqe1.jpeg,loving game something bugging want pose photo mode able naoe meditation pose anywhere would awesome lol also anyone else feel like game camera close character could though,0,2025-03-24 21:31:43,1.0
yasuke really kimono,3,1jj2jb5,https://www.reddit.com/r/AssassinsCreedShadows/comments/1jj2jb5/does_yasuke_really_not_have_a_kimono/,really hope missing something see cutscenes purple one get play bit get taken away really one lol,3,2025-03-24 21:29:42,1.0
amazing perfect,2,1jj5h13,https://www.reddit.com/r/AssassinsCreedShadows/comments/1jj5h13/amazing_but_not_perfect/,playing hour game truly breathtaking area environment weather best ever seen video game plot better recent assassin creed game combat smooth responsive main problem game pacing intro game long tedious see new player returning old player would turned reminds beginning ac play close hour everything get started anyone else feel way valhalla somewhat long beginning bad origin odyssey good paced beginning opinion side quest character fall flat well memorable way overall though definitely deserves high score getting,0,2025-03-24 23:32:50,1.0
best assassin creed game ever made nothing change mind huge congrats dev team made something real special,291,1ji8i3y,https://i.redd.it/4nymy7elxhqe1.jpeg,literally everything game feel amazing hour yet use horse world created beautiful go perfect thing game would end writing story love game still beginning also found customize every single aspect secondary weapon awesome,46,2025-03-23 20:12:17,1.0
wanted glitch,2,1jj52kh,https://www.reddit.com/r/AssassinsCreedShadows/comments/1jj52kh/wanted_glitch/,discovered enemy fortress bell rang got red wanted sign top screen defeating looting chest left wanted sign still whether city water hideout wanted sign constantly also restarted game work permanent,2,2025-03-24 23:15:37,0.0
stuck chimesprayerreflection site,2,1jj52j9,https://v.redd.it/44jzy1710qqe1,even know proper name ingame activity first time reached anyone else stuck forever,1,2025-03-24 23:15:35,0.0
quite happy someone like rpg era game,2,1jj4vkl,https://www.reddit.com/r/AssassinsCreedShadows/comments/1jj4vkl/im_quite_happy_as_someone_who_didnt_like_the_rpg/,elegant action oriented combat check cool looking flowing parcour check compelling ground breaking character story check style check bad as stealth check awesome atmosphere amazing setting graphic check somewhat rewarding exploration check performance least ok check even something like black box mission check love grappling hook check amazing japanese voice acting check gripe course still typical overused ubisoft formular found wow actually trying better hour main side mission really surprised writing creativity assassination wasako tea ceremony loved whole sequence onto attack lord nobunaga starting cool naoe hiding cart also adore silent assassination animation good freakin job p shoutout fuck moderator rassassinscreed removing post giving opinion allowing multiple post exact thing,5,2025-03-24 23:07:26,1.0
map feel huge,2,1jj4qh6,https://www.reddit.com/r/AssassinsCreedShadows/comments/1jj4qh6/the_map_feels_huge/,fan stupidly big video game map slightly disappointed finding comparitvely small size shadow however playing hour feel absolutely gigantic done amazing job filling scaling worry gone odyssey favourite pick point horizon sail bit worried shadow would magic way,0,2025-03-24 23:01:32,0.0
bug,2,1jj4os5,https://www.reddit.com/r/AssassinsCreedShadows/comments/1jj4os5/bugs/,noticing sound bug issue going waterfall sound working slide sound going hill cut come back meditation event katana sound,0,2025-03-24 22:59:46,0.0
little late post meme feel like waited long enough post,188,1jibbrr,https://i.redd.it/xiaj51h9kiqe1.jpeg,recognize first guy john blackthorne one main character fx series sh gun came year ago hulu also apparently real historical figure heard also became samurai like yasuke spoiler happened show yet blackthorne becoming samurai real life author original sh gun book got whole inspiration book least heard,45,2025-03-23 22:14:39,1.0
success mean post launch content beyond one expansion,2,1jj47i2,https://www.reddit.com/r/AssassinsCreedShadows/comments/1jj47i2/what_does_success_mean_for_post_launch_content/,one planned expansion please use spoiler tag completed game quality life update basically understand think get one say use spoiler tag could story reason one expansion,2,2025-03-24 22:39:16,1.0
chest containing legendary item near viewpoint,2,1jj437y,https://www.reddit.com/r/AssassinsCreedShadows/comments/1jj437y/there_are_chests_containing_legendary_items_near/,know anyone told may chest containing legendary item near viewpoint away living area far found legendary weapon trinket,0,2025-03-24 22:34:19,0.0
call next gen game,90,1jifl7e,https://www.reddit.com/gallery/1jifl7e,name game better graphic combined performance,12,2025-03-24 01:37:53,1.0
super pc crashed,2,1jj3nu9,https://www.reddit.com/r/AssassinsCreedShadows/comments/1jj3nu9/4080_super_pc_crashed/,super kf gb ram twice pc crashed playing game nvidia thing latest driver,0,2025-03-24 22:16:22,1.0
hideout architect miss little corner small cosmetic spoiler,4,1jixwpx,https://www.reddit.com/r/AssassinsCreedShadows/comments/1jixwpx/hideout_architects_dont_miss_this_little_corner/,discovered little sweet corner outside obivious big chunk squealed glee miss spent time designing hideout,5,2025-03-24 18:27:47,1.0
new ranking assassin creed rpg shadow best worst,3,1jizpjb,https://www.reddit.com/gallery/1jizpjb,shadow absolutely blown away expectation ever since gotten absolutely gorgeous open world compare rdr going best stealth franchise since unity pretty damn solid combat exploration story character however put origin shadow sadly naoe yasuke feel bland bayek alongside edward ezio course probably well developed character series interchangeable love odyssey valhalla video game assassin creed game let know think,10,2025-03-24 19:38:19,1.0
photo,2,1jj312z,https://www.reddit.com/gallery/1jj312z,tried photo mode last time posted reddit got ridiculed reddit professional photographer keep mind,3,2025-03-24 21:50:11,0.0
assassin gear location,2,1jj2tyu,https://www.reddit.com/r/AssassinsCreedShadows/comments/1jj2tyu/assassin_gear_location/,tried googling pulling much anyone know find initiate apprentice assassin gear,0,2025-03-24 21:41:50,0.0
keep reroll,2,1jj2p6b,https://i.redd.it/16fgzm6bipqe1.png,genuine advice please thank,5,2025-03-24 21:36:19,1.0
highest leap yet wanted share,4,1jiwval,https://v.redd.it/n2zor83idoqe1,always fun well diving water,0,2025-03-24 17:47:40,1.0
lost weapon yasuke,2,1jj1xwa,https://www.reddit.com/r/AssassinsCreedShadows/comments/1jj1xwa/i_lost_all_my_weapons_as_yasuke/,duelled yuki kata naginata master lost weapon except naginatas equipped bow weird got achievement getting one every type legendary weapon moment gone realized happened fast travelled destroyed autosave could save last hour gameplay lesson learned manual save regularly,1,2025-03-24 21:05:28,0.0
graphic issue,2,1jj1uuc,https://www.reddit.com/r/AssassinsCreedShadows/comments/1jj1uuc/graphics_issues/,really want enjoy game run poorly p digital graphic world fine character movement look god awful anyone help fix would greatly appreciated never seen game run like consolemonitor,1,2025-03-24 21:02:04,1.0
alternative control,2,1jj1ui9,https://www.reddit.com/r/AssassinsCreedShadows/comments/1jj1ui9/alternative_controls/,hi alternative control work well prefer dodge parry moment nothing work well,0,2025-03-24 21:01:41,1.0
til enter hideout,4,1jivyai,https://www.reddit.com/r/AssassinsCreedShadows/comments/1jivyai/til_you_can_enter_the_hideout/,literally direction get short fade black border enter exit direction want,0,2025-03-24 17:11:08,1.0
tryna play,2,1jj1ksj,https://www.reddit.com/r/AssassinsCreedShadows/comments/1jj1ksj/just_tryna_play/,anyone else issue game like stuttering freezing still move camera around physic working found fix lmk,4,2025-03-24 20:51:08,0.0
need help figuring song game,2,1jj1ddi,https://www.reddit.com/r/AssassinsCreedShadows/comments/1jj1ddi/need_help_in_figuring_out_a_song_in_the_game/,one song naoe injured dad come protect ask box taken dad say box immediately bad guy horse come say right song play badass song heard please help figure,1,2025-03-24 20:42:51,1.0
season change fast,3,1jixsny,https://www.reddit.com/r/AssassinsCreedShadows/comments/1jixsny/the_seasons_change_so_fast/,seems like every time fast travel switch character season change make feel like quest taking year complete,2,2025-03-24 18:23:13,1.0
character preference,338,1ji3bmi,https://i.redd.it/rncj3kdkvgqe1.jpeg,playstyle enjoying shadow naoes stealthy assassin approach using eagle vision plan silent kill feel og way play ac yasuke brute force combat tearing multiple enemy curious see people finding fun always played game much stealth possible trying go unnoticed time planning route also past act playing people yasuke,343,2025-03-23 16:34:26,1.0
