Title,Upvotes,Post ID,URL,Text,Comment Count,Posted Date,sentiment
hour objective giving anxiety,1,1ji4bru,https://www.reddit.com/r/AssassinsCreedShadows/comments/1ji4bru/30_hours_in_and_objectives_are_giving_me_anxiety/,clearly enjoying playing objective screen filling lot stuff hard keep track objective screen like skill tree missionstasks rather skill hard say better odyssey valhalla applicable section appreciate trying something new seeing one place giving anxiety panel layout also helpful want way see list way narrow move plot forward extra personal side story may matter example safehouse task show map anyone figured efficient way keep track everything need order starting somewhere working one check mark time,0,2025-03-23 17:16:47,1.0
losing legendary armorsweapons bug spoiler,2,1jhzapl,https://www.reddit.com/r/AssassinsCreedShadows/comments/1jhzapl/losing_legendary_armorsweapons_bug_no_spoiler/,save every missionmemory know inventory bug going right need immediate fix far two legendary weapon disappear inventory bow yasuke tanto noae item unattainable bug would known hand would saving every mission someone find fix would greatly appreciated,0,2025-03-23 13:30:14,1.0
p pro quality mode v performance mode,1,1ji44lf,https://www.reddit.com/gallery/1ji44lf,sticking quality mode wantes check performance mode though reflection really important give especially rain difference believe curious,0,2025-03-23 17:08:28,1.0
dislike game due gameplay bug story ect fine dislike game simply due black man woman mc man baby get internet sensitive snowflake,0,1jifuu5,https://www.reddit.com/r/AssassinsCreedShadows/comments/1jifuu5/if_you_dislike_the_game_due_to_gameplay_bugs/,believe many stupid idiot seen cry raging fact play black man japan even though legit historically accurate actual black ancient japanese time real life actually getting offended pixel poc woman really see therapist mentality ill want know reaction heard character nothing care like well jesus internet really brainroted brainwashed people thinking say whatever frick want without consequence hiding behind screen get cry sensitive snowflake cry mc white straight ci male,8,2025-03-24 01:51:37,0.0
limited climbingparkor,1,1ji4089,https://www.reddit.com/r/AssassinsCreedShadows/comments/1ji4089/limited_climbingparkor/,upgrade game help lackluster climbing ability feel like really really want travel via preestablished path able bline sync point poi understand path want take minute detour sync point directly next slide tiniest rocksinclines past two played like take path go anywhere problem plus beginning watch cutscene naoe climbing cliff face problem funny let get achievement using guided mode middle forest pretty much forced use pathfinding option go destination anyway point,3,2025-03-23 17:03:24,1.0
smuggled good automatically added,2,1jhyylu,https://www.reddit.com/r/AssassinsCreedShadows/comments/1jhyylu/smuggled_goods_automatically_added/,hey smuggled good went hideout gave prompt opening somewhere find please help,3,2025-03-23 13:12:41,1.0
need help,2,1jhywnk,https://www.reddit.com/r/AssassinsCreedShadows/comments/1jhywnk/need_help/,hello everyone bought acshadows launched pc exceed fps even loading understand everything work fine pc component rx xt ryzen gb corsair mt screen hope someone solution would like enjoy game knowing pc month old thank,2,2025-03-23 13:09:49,1.0
hidden blade nerfed,2,1jhyu54,https://www.reddit.com/r/AssassinsCreedShadows/comments/1jhyu54/has_the_hidden_blade_been_nerfed_again/,think past prologue world seems opened noticed hidden blade work specific condition like enemy behind appears work fine trying classic hiding grass whistle get seen call guard make stealth run lot difficult case nerfed simply case need level pick correct skill skill tree,5,2025-03-23 13:06:12,0.0
game keep hard crashing p,1,1ji3l5q,https://www.reddit.com/r/AssassinsCreedShadows/comments/1ji3l5q/game_keeps_hard_crashing_my_ps5/,hey guy really wanting play game hour game time completely hard crash p unplug p power source restore hard drive every single time rebuilt data base made sure p game date reinstalled sure game problem l handle game anyone solution,2,2025-03-23 16:45:40,1.0
icon mean,1,1ji3jew,https://i.redd.it/0u38t6u3xgqe1.jpeg,tried looking everywhere find reference red skull icon clearly mean character something special show every person mark,7,2025-03-23 16:43:43,1.0
assassin creed shadow amazing,1,1jhymzl,https://www.reddit.com/r/AssassinsCreedShadows/comments/1jhymzl/assassins_creed_shadows_is_amazing/,completed act final cutscenes final castle run absolutely amazing theme music playing perfect set tone even better canon mode especially building fire damn set tone perfectly realisation chef kiss wait play fun game deserve hate played game would realise amazing far comparable yes rdr ubisoft really outdid get paid armour weapon free exchange show ubi greedy,0,2025-03-23 12:56:04,1.0
character swap ingame,1,1ji3g6l,https://www.reddit.com/r/AssassinsCreedShadows/comments/1ji3g6l/character_swap_ingame/,realized actually change yatsuke want play character figured game section focused one hot swap character found first tomb naoe look like need yatsuke break,7,2025-03-23 16:39:51,1.0
twisted tree,2,1jhyl3b,https://www.reddit.com/r/AssassinsCreedShadows/comments/1jhyl3b/the_twisted_tree/,day last night got past part get yasuke picked note ground led assassination target whilst still naoe get yasuke whole target board already completed never got introduction folk miss get probably internal kyoto politics carrying yasuke join remember ever introduced,3,2025-03-23 12:53:08,0.0
npc fight village,1,1ji3f7a,https://www.reddit.com/r/AssassinsCreedShadows/comments/1ji3f7a/npc_fights_in_village/,random npc fight village street katano ronin fighting get involved nothing happens slaughter wondering missed something red npc small arrow head,0,2025-03-23 16:38:43,0.0
love photomode,1,1ji3atf,https://i.redd.it/2wt5zo4dvgqe1.png,photomode huge reason stay game long post picture everywhere one certainly move right direction could extra light option time change pose maybe fall behind many game day game deserves shown glory,0,2025-03-23 16:33:30,1.0
p pro displaying balanced mode,2,1jhygwb,https://www.reddit.com/gallery/1jhygwb,hello issue copy ac shadow enjoying hame however getting incorrect resolution frame rate p pro quality getting though game optimiser tv showing fps feed bot much issue since would play mode big issue balanced mode game rendering per tv frame rate showing fps lastly tried performance showing probably upresed showing fps degraded detail rtgi anyone else issue find strange cable original cable came console issue game anyone advise end,5,2025-03-23 12:46:36,1.0
find anywhere engraving,1,1ji37ym,https://i.redd.it/sxi5ap8sugqe1.jpeg,avenging senseis death received normal reward knew would get also got improved counter attack engraving life find anywhere anyone know wtf,5,2025-03-23 16:30:03,0.0
dumb question scot find answer,1,1ji30lg,https://www.reddit.com/r/AssassinsCreedShadows/comments/1ji30lg/dumb_question_about_scots_but_cant_find_an_answer/,mark pallet go inventory end season automatically pop mentioned salvage chest seem find one hideout material,1,2025-03-23 16:21:01,0.0
winter,0,1ji2zkm,https://www.reddit.com/r/AssassinsCreedShadows/comments/1ji2zkm/winter/,okay open world really grew damn winter pretty,0,2025-03-23 16:19:50,1.0
pc crash minute gameplay,1,1ji2yi0,https://www.reddit.com/r/AssassinsCreedShadows/comments/1ji2yi0/my_pc_crashes_after_about_20_minutes_of_gameplay/,loving game far first three four hour perfectly fine finished prologue started exploring open world entire pc started crashing playing minute similar issue odyssey way back day ended bad constant crash fried graphic card get new one played ac game pc since figured either odyssey problem old graphic card something wrong happening year later shadow sometimes pc restarts crash immediately crash window error message sad face even open anything anyone know good solution,0,2025-03-23 16:18:32,0.0
season winter,1,1ji2yhr,https://www.reddit.com/r/AssassinsCreedShadows/comments/1ji2yhr/seasons_wheres_winter/,confused gone whole season circle winter snow honestly even though say season changed game look something wrong haha know see season top right corner map nesw circle season last two part seen winter done full circle also indication current season actually like really circle would nice said summer autumn winter spring,1,2025-03-23 16:18:32,1.0
katana counter attack,2,1jhy7xt,https://www.reddit.com/r/AssassinsCreedShadows/comments/1jhy7xt/katana_counter_attack/,knowledge rank counter attack skill katana tree still say progress story anyone know quest need finish unlock cheer,0,2025-03-23 12:32:29,1.0
bug mission prevents advancing,1,1ji2w04,https://v.redd.it/3xtuc5torgqe1,tea party happens know anymore,1,2025-03-23 16:15:32,1.0
gear loadouts,1,1ji2rwa,https://www.reddit.com/r/AssassinsCreedShadows/comments/1ji2rwa/gear_loadouts/,built gallery got tutorial gear loadouts seem see make save need unlock character,0,2025-03-23 16:10:41,1.0
seasonal change clearing area annoying,14,1jhoxwc,https://www.reddit.com/r/AssassinsCreedShadows/comments/1jhoxwc/seasonal_changes_while_clearing_out_areas_is/,taking time clearing castle went stealthy took everyone looted time got rd leader area get chest season changed must close changing prior entering literally reset every single enemy castle run get chest run away feel like fighting everyone able happen middle campcastle anyway liberate point interest enemy reset,7,2025-03-23 02:14:29,0.0
ac shadow question,1,1ji2ljp,https://i.redd.it/lg4dbmeypgqe1.jpeg,get perk activate chance impact,5,2025-03-23 16:02:59,1.0
shadow indeed best glitch far messing photo mode,3,1jhvwae,https://v.redd.it/uodjpj0bxeqe1,played around photo mode much game enabled permanently xd p reloading game fixed looked quite cool honest,2,2025-03-23 10:00:42,1.0
know engraving stack,1,1ji2c61,https://www.reddit.com/r/AssassinsCreedShadows/comments/1ji2c61/do_we_know_if_engravings_stack/,want engrave damage affliction katana tanto sure stack clue thanks,2,2025-03-23 15:51:48,1.0
best reshade far look beautiful,1,1ji2832,https://www.reddit.com/gallery/1ji2832,using real life assassin creed shadow reshade,0,2025-03-23 15:46:48,0.0
alright actually creeped,3,1jhvnoa,https://v.redd.it/daoyoa9cteqe1,sure bug definitely eerie haha,1,2025-03-23 09:42:50,1.0
anyone else miss follow road mount anymore,27,1jhjn2t,https://www.reddit.com/r/AssassinsCreedShadows/comments/1jhjn2t/does_anyone_else_miss_not_being_to_follow_the/,loving game already hour however find pressing joystick travel really long distance quite tedious love autofollow mode miss mount able automatically take destination,16,2025-03-22 21:50:25,1.0
movement terrible desperately need unity,0,1jiaa3o,https://www.reddit.com/r/AssassinsCreedShadows/comments/1jiaa3o/the_movement_is_terrible_we_desperately_need/,finally ninja assassin creed game thought finally would getting really good parkour rival ac unity love cool flip naoe hold descend button however otherwise really good parkour nearly smooth fun beautiful unity city great parkour either city like paris better parkour period however still expected see massive sprawling japanese city lot tall building great opportunity awesome parkour even historically accurate game also stylish enough way shurikens example feel like afterthought even see shuriken camera zoom make u feel like ninja simply feel like ninja assassin creed game always wanted honestly felt like ninja ac combat system side note watched digital foundry video understand ac shadow technically graphically advanced look stunning time unity appealing graphic lighting going wowed way often,14,2025-03-23 21:28:40,1.0
music bos fight,2,1jhxen2,https://www.reddit.com/r/AssassinsCreedShadows/comments/1jhxen2/music_during_boss_fights/,way turn music fight music turned nothing music seem connected music setting prefer listening music turn mission kind annoying,1,2025-03-23 11:44:10,0.0
long start getting trinket spoiler,1,1ji1mj7,https://www.reddit.com/r/AssassinsCreedShadows/comments/1ji1mj7/how_long_until_you_start_getting_trinkets_spoilers/,currently level assassinated main commander whatever call cleared multiple castle killing shinobis looting chest non stop yet still yet receive single trinket buddy mine level said received multiple trinket since early game bad rng gone shop sell weapon trinket offer assuming armor shop thanks advance,3,2025-03-23 15:19:55,0.0
wish turn flashing grey blue cross enemy attack,0,1ji1lit,https://www.reddit.com/r/AssassinsCreedShadows/comments/1ji1lit/i_wish_we_can_turn_off_the_flashing_grey_and_blue/,setting anyway coming sekiro player played ac main title feel like flashing x make parrying much easier literally tell enemy attack mention parry window large even expert want look swing sword parry unblockables well need differentiate dodge compared sekiro unblockables spammed succession well like second two sekiro unblockable hit least yasuke responsive dodging,0,2025-03-23 15:18:37,1.0
assassin creed shadowbest buy,0,1ji1j7u,https://www.reddit.com/r/AssassinsCreedShadows/comments/1ji1j7u/assassins_creed_shadowbest_buy/,worth buying,1,2025-03-23 15:15:33,1.0
name song,1,1ji1iv3,https://v.redd.it/m3ukm9cehgqe1,anyone know name song soundtrack song play restricted area like palace,0,2025-03-23 15:15:08,1.0
early get kusarigama wepon,1,1ji1i3q,https://www.reddit.com/r/AssassinsCreedShadows/comments/1ji1i3q/how_early_can_i_get_that_kusarigama_wepon/,play much upcoming exam kusarigamablood reaper favorite wepon shadow fight really want get one game saw one assassination target reward kusarigama way get one,4,2025-03-23 15:14:12,1.0
gennojo pretty insufferable,7,1jhrexv,https://www.reddit.com/r/AssassinsCreedShadows/comments/1jhrexv/gennojo_is_pretty_insufferable/,man smooth sandpaper creep man street,2,2025-03-23 04:37:44,0.0
find deluxe edition item,1,1ji1fgf,https://www.reddit.com/r/AssassinsCreedShadows/comments/1ji1fgf/how_to_find_deluxe_edition_items/,hello find deluxe edition item read inventory unlocked hideout inventory find item,0,2025-03-23 15:10:51,0.0
problem p controller,1,1ji10g9,https://www.reddit.com/r/AssassinsCreedShadows/comments/1ji10g9/problem_with_ps5_controller/,p controller recognized xbox controller game bought game ubisoft connect maybe mistake never got p button display tried setting ubisoft connect nonsteam game nothing worked issue,0,2025-03-23 14:52:09,0.0
day microtransactions bullshit game,0,1ji5vez,https://www.reddit.com/r/AssassinsCreedShadows/comments/1ji5vez/day_1_microtransactions_are_bullshit_and_shouldnt/,able unlock everything game want add dlc month get content fine roll add content kind like skyrim creation club year release creating content could game making people pay bullshit wanted make special item couple month make sense legit rolled cosmetic item go like price game look different bullshit,5,2025-03-23 18:21:18,1.0
ac shadow ce gamestop preorder,1,1ji0nh6,https://www.reddit.com/r/AssassinsCreedShadows/comments/1ji0nh6/ac_shadows_ce_gamestop_preorder/,anyone else still waiting gamestop ship preorder ordered collector edition told thursday preparing ship online still say status shipping update,0,2025-03-23 14:35:29,0.0
tried make something gloomy photo mode first try,7,1jhs87v,https://i.redd.it/czeh18j2ldqe1.png,could done better though,0,2025-03-23 05:30:16,1.0
xbox collector amazon good price,0,1ji06lv,https://www.reddit.com/r/AssassinsCreedShadows/comments/1ji06lv/xbox_collector_on_amazon_be_at_good_price/,today noticed amazon xbox version euro efigs version mean english french italian german spanish know point mentioning also double order cancelled today pickup order mediamarkt nl location breda netherlands sure offer back online put store thought would mention incase someone felt like look guarantee though oh double order parent made one without knowing hope help someone also p say french know box content like euro pc also available efigs version euro,0,2025-03-23 14:13:34,1.0
pc setting inconsistent,1,1ji00yv,https://www.reddit.com/r/AssassinsCreedShadows/comments/1ji00yv/pc_settings_inconsistent/,hi hope everyone well sorry posted anyone finding wildly different fps time boot yesterday dlss option using fsr fsr frame gen getting around high boot morning fps tanked tinkering setting dlss back performance near fsr frame gen seem even affect performance almost like setting actually activating anyone anything like,8,2025-03-23 14:06:16,1.0
unable change keybind ground attack change stance riding horsepc,1,1jhzsof,https://www.reddit.com/r/AssassinsCreedShadows/comments/1jhzsof/unable_to_change_keybind_for_ground_attack_and/,change parry every time try ground attack yasuke parry first change sprint alt use spacebar dodge riding horse every time sprint also change stance,0,2025-03-23 13:55:22,0.0
already hate yaya,0,1jhzn86,https://www.reddit.com/r/AssassinsCreedShadows/comments/1jhzn86/i_already_hate_yaya/,buying monk forgiveness philosophy actually betrays concept justice,12,2025-03-23 13:47:45,1.0
ac name sakai tea quest choice,2,1jhvutk,https://www.reddit.com/r/AssassinsCreedShadows/comments/1jhvutk/ac_name_sakai_tea_quest_choice/,hello tea quest choose otome wakasa otome say expression golden tempo said cut scene acting like knew naoe wakasa say naoe could incriminate otome,2,2025-03-23 09:57:45,1.0
naoe gave,3,1jhu2o8,https://v.redd.it/i5co89w29eqe1,enough decided join father,0,2025-03-23 07:44:51,1.0
nice walk,10,1jhoek2,https://v.redd.it/0tfsk5tqgcqe1,added music took silent beautiful,2,2025-03-23 01:45:07,1.0
mastery point bound loadout,0,1jhzefy,https://www.reddit.com/r/AssassinsCreedShadows/comments/1jhzefy/mastery_points_bound_to_loadout/,since weapon specific skill tree find swich loadouts respec mastery point got new weapon like loadout tanto kusarigama anf one katana kusarigama changing stil need unbind point either katana tanto respec anyone find also anoying try get patch,0,2025-03-23 13:35:27,0.0
anyone else avoid killing servant,18,1jhjp7i,https://www.reddit.com/r/AssassinsCreedShadows/comments/1jhjp7i/anyone_else_avoid_killing_the_servants/,actually violent unless get close go get guard hide told told stop lying probably lost fair amount xp regular people,60,2025-03-22 21:53:16,0.0
xbox incompatibility,2,1jhvmzj,https://www.reddit.com/r/AssassinsCreedShadows/comments/1jhvmzj/xbox_incompatibility/,literally bought game say incompatible device anyone else problem solved,3,2025-03-23 09:41:28,0.0
change katana tanto,2,1jhvmrw,https://www.reddit.com/r/AssassinsCreedShadows/comments/1jhvmrw/heres_how_to_change_between_the_katana_and_the/,anyone else annoyed bug make impossible switch katana tanto press right arrow button mid attack without enemy able switch weapon,1,2025-03-23 09:41:02,0.0
upgrade horse ranch soon possible,33,1jhfeae,https://www.reddit.com/r/AssassinsCreedShadows/comments/1jhfeae/upgrade_horse_ranch_asap/,upgrading allows use less scout transport stolen resource also increase much bring season game going heavy collecting resource investing multiplier early huge advantage,12,2025-03-22 18:40:23,1.0
heavy attack pc,3,1jhtlbj,https://www.reddit.com/r/AssassinsCreedShadows/comments/1jhtlbj/heavy_attack_on_pc/,tried find post could adding figured heavy attack work default kbmouse enjoyer use shift left click stupid overridebug happens light come exception heavy hold attack would work made think ok rebind shift left click single button attack like side mouse key try movesets opened lot new combat flow,1,2025-03-23 07:08:06,0.0
hot take,18,1jhixqs,https://www.reddit.com/r/AssassinsCreedShadows/comments/1jhixqs/hot_take/,going go ahead say love shadow played hour feel like easily better valhalla go ahead say love odyssey may much fat odyssey good thing loving story immersive mode expert avoiding english voice over honestly gameplay loop super solid think allot people beginning spoiled know want skyrimassassins creed know maybe absolute joy play obviously paid ad,4,2025-03-22 21:17:47,1.0
assassination,2,1jhv6rl,https://i.redd.it/nqhyhuotneqe1.jpeg,know say title,0,2025-03-23 09:07:31,0.0
gear level restriction exist,0,1ji3ayd,https://www.reddit.com/r/AssassinsCreedShadows/comments/1ji3ayd/gear_level_restrictions_should_not_exist/,earn able use always felt way hated game restrict ability use something character level push something difficult reward match able wear armor equip weapon feel like slap face effort player,0,2025-03-23 16:33:40,0.0
anyone know get color ronin outfit,1,1jhyceh,https://www.reddit.com/r/AssassinsCreedShadows/comments/1jhyceh/does_anyone_know_how_to_get_this_color_for_the/,outfit green sometimes inventory switch cooler black yellow wondering anyone knew find,0,2025-03-23 12:39:34,0.0
shadow fun game,5,1jhqg24,https://v.redd.it/i97tf8ea1dqe1,people wanted game fail bad,0,2025-03-23 03:39:31,0.0
max performance worse steam deck,3,1jhrlc0,https://www.reddit.com/r/AssassinsCreedShadows/comments/1jhrlc0/the_m1_max_performance_is_worse_than_the_steam/,manage get game running worse max steam deck mac port oh god max steam deck sad mac gaming,0,2025-03-23 04:48:58,0.0
assassin creed shadow spoiler megathread spoiler allowed,28,1jf1v3t,https://www.reddit.com/r/assassinscreed/comments/1jf1v3t/assassins_creed_shadows_spoiler_megathread/,hey everyone happy shadow launch day today join shinobi naoe samurai yasuke join force mysterious group enemy megathread everyone discus spoiler filled first impression game feel free discus main story side quest animus hub content random event deeper lore anything else may like rule around polite request please hide spoiler endgame quest content people may want rush story immediately others would prefer enjoy game world slower pace guy please considerate fellow reader posting subreddit please read follow rule especially regarding spoiler mean make sure add spoiler title wish discus spoiler ever post actual spoiler title hide spoiler preferred method naoe shinobi result naoe shinobi leave space start end also use spoiler function reddits text editor alternative method old reddit shadow spoiler naoe shinobi result shadow spoiler naoe shinobi method primarily work old reddit may work redesign encourage everyone use first preferred method looking general non spoiler discussion go general megathread catch shadow review review megathread thank understanding happy gaming moderation team rassassinscreed,258,2025-03-19 17:01:33,1.0
thank message assassin creed shadow development team,8800,1ji1c9q,https://www.reddit.com/r/assassinscreed/comments/1ji1c9q/thank_you_a_message_from_the_assassins_creed/,hello everyone weekend many u dev team spent time reading reaction across assassin creed subreddit want say thank sheer amount love positivity received incredibly heartwarming came across post particular really moved u seeing excitement thoughtful reaction joy meant world u year hard work nothing rewarding watching community connect created reply directly please know listening entire dev team reading post celebration feedback theory inspiring fuel u help u keep improving thank part journey u beginning shadow thrilled see game evolve side men blindly follow truth remember nothing true assassin creed shadow dev team,918,2025-03-23 15:06:53,1.0
vgs source assassin creed shadow series second biggest launch ever,460,1jiyvou,https://www.reddit.com/r/assassinscreed/comments/1jiyvou/vgs_sources_assassins_creed_shadows_is_the_series/,according data seen vgc shadow delivered secondhighest day sale revenue franchise history behind valhalla notably launching march series entry arrived lucrative thanksgiving season benefit pandemic boost enjoyed valhalla shadow marked ubisoft bestever day launch playstation digital store wishlisted ubisoft title time generated million hour watched twitch strongest start recent ubisoft title including valhalla,96,2025-03-24 19:05:18,1.0
assassin creed shadow biggest physical sale launch uk year easily surpassing monster hunter wild christopher dring,590,1jiqvld,https://www.reddit.com/r/assassinscreed/comments/1jiqvld/assassins_creed_shadows_is_the_biggest_physical/,term physical sale assassin creed shadow biggest uk game launch year comfortably ahead monster hunter wild also sold boxed copy week star war outlaw managed month well short valhalla,86,2025-03-24 13:38:46,0.0
wow ac shadow truly unique experience,369,1jiriwi,https://www.reddit.com/r/assassinscreed/comments/1jiriwi/wow_ac_shadows_is_truly_a_unique_experience/,playing game like long time played ac game enjoyed valhalla favorite anymore shadow experience unique stealth amazing combat amazing story invested throw kill bill vibe mention feel like actually world get lost followed creek like hr daughter followed creek led different waterfall along way found treasure top capturing every time play force get sleep work good good job dev team shit rock,130,2025-03-24 14:09:15,1.0
safe say assassin creed shadow one best game series,62,1jj5m09,https://www.reddit.com/r/assassinscreed/comments/1jj5m09/its_safe_to_say_that_assassins_creed_shadows_is/,know ubi completely nailed apart bug game great yeah thing could use tweak next game like parkour variety system overall incredibly welldone game graphic story combat system stealth level design openworld activity see system made oldseries gamers critique mind considering new player opinion well great job ubisoft,28,2025-03-24 23:38:34,1.0
sneaking impossible day,314,1jiol1c,https://www.reddit.com/r/assassinscreed/comments/1jiol1c/sneaking_isnt_impossible_during_the_day/,sub post saying thing like suck castle found day game force leave running something else pas time progamer expert level stealth challenging super hard cool like nighttime aesthetic want play need pretending sun negates stealth ac shadow problem clearing large castle day night,120,2025-03-24 11:39:18,1.0
