Title,Upvotes,Post ID,URL,Text,Comment Count,Posted Date,sentiment
like assassin creed reference tcgw,4,1i0nncg,https://www.reddit.com/r/ubisoft/comments/1i0nncg/i_like_the_assassins_creed_reference_in_tcgw/,enter rendezvous guy watching little brother stealing uranium helicopter sitting look like pspsteamdeck esque console hear eagle scream someone jumping fast travel point haystack know nothing major made smile two favorite series,2,2025-01-13 20:25:12,
link xbox account different ubisoft account lose stuff,2,1i0rlyw,https://www.reddit.com/r/ubisoft/comments/1i0rlyw/if_i_link_my_xbox_account_to_a_different_ubisoft/,playing lot siege lately want access marketplace ubisoft account email exist anymore wondering link xbox account different ubisoft account lose stuff siege,3,2025-01-13 23:13:02,
prince persia sand time,6,1i063b9,https://www.reddit.com/r/ubisoft/comments/1i063b9/prince_of_persia_sands_of_time/,call crazy would really really love ubisoft remastered prince persia sand time literally one greatest game ever played life,5,2025-01-13 04:34:14,
ubisoft able take game,0,1i0imzm,https://www.reddit.com/r/ubisoft/comments/1i0imzm/ubisoft_shouldnt_be_able_to_take_our_games/,company sell product user take away without compensation scamming genuinely fraudulent behavior best downright stealing worst,75,2025-01-13 17:00:58,
ubisoft classic playstation plus extra way upgrade ubisoft premium without pay separately,6,1hzsxnd,https://www.reddit.com/r/ubisoft/comments/1hzsxnd/have_ubisoft_classic_through_playstation_plus/,basically title classic thanks p extra want get premium play ac shadow way upgrade pay difference would need purchase premium separate classic p get,4,2025-01-12 18:15:37,
anybody else enjoy ubisoft map bloat,52,1hzdt8n,https://www.reddit.com/r/ubisoft/comments/1hzdt8n/anybody_else_enjoy_the_ubisoft_map_bloat/,playing watch dog franchise right however also played classic ubi title finding really really enjoy massive world developer drop shit give yes get repetitive however comfort knowing going spend hour hour whatever beautiful world created,56,2025-01-12 03:34:54,
ubisoft going see act like nothing wrong,0,1i0alju,https://www.reddit.com/r/ubisoft/comments/1i0alju/ubisoft_gonna_see_this_and_act_like_nothing_is/,delivery tomorrow ahh ping,3,2025-01-13 09:52:23,
possible swap another ubisoft account steam,0,1hzmeet,https://www.reddit.com/r/ubisoft/comments/1hzmeet/is_it_possible_to_swap_to_another_ubisoft_account/,long story short younger dad linked ubisoft account steam account adult would like swap current account consistency reason unlink dad account link new one work allow one ubisoft account linked,3,2025-01-12 13:14:11,
free discount code minimum,3,1hze8bo,https://www.reddit.com/r/ubisoft/comments/1hze8bo/free_50_discount_code_off_of_75_minimum/,hello everyone received discount code along black blue yeti microphone bought last summer since usually play ubisoft game figured would give someone would actually find use code remember reading tc code month back remember exact expiration date want say somewhere around middle january apologize code longer valid small writing slip code combinable game sale may huge plus one anyone try redeeming please let know work expired take post code vmntcvpnz vmntcvpnz,0,2025-01-12 03:58:27,
took ubisoft long realize releasing halfbaked unfinished game dosent make cut anymore,0,1hzbjak,https://www.reddit.com/r/ubisoft/comments/1hzbjak/why_it_took_ubisoft_so_long_to_realize_that/,feel like matter game going develop right instead ac shadow would still get delayed twice lose money anymore tanking company stock ruining reputation rapid release unfinished game fortunately work people spoke wallet somehow unsmart enough realize late busy trying push nonsense agenda throat seems like trying offset horrible decision made ac shadow polishing game actually trying make decent financially struggling would release game dig graf tldr realizing need actually develop sell good game rather pushing nonsense agenda intentionally making controversial decision took age,37,2025-01-12 01:31:44,
dear ubisoft star war outlaw great,0,1hz7jnu,https://www.reddit.com/r/ubisoft/comments/1hz7jnu/dear_ubisoft_star_wars_outlaws_was_great_do_more/,play launch understand challenged game still buggy frustrating way pat back much best game played since watch dog star war setting great map felt big without unnecessarily big looking breakpoint part akiva fun drive around typical ubisoft way far many collectible item felt lot reasonable space area fun gave tachyon nostalgia stealth challenging finding sneaky way usually turning right walking around corner npc bit static star war vibe good enough like wd,28,2025-01-11 22:21:29,
please add helix currency steam platform,0,1hyz0zc,https://www.reddit.com/r/ubisoft/comments/1hyz0zc/please_add_the_helix_currency_to_the_steam/,good evening want contact ubisoft buying game different platform year sad see cool campaign problem supporting game well lately question replenishment helix currency steam platform assassin creed ghost recon series need money,5,2025-01-11 16:04:24,
looking uno player,5,1hxtecg,https://www.reddit.com/r/ubisoft/comments/1hxtecg/looking_for_uno_players/,hey anyone want play uno xbox series please dm play,3,2025-01-10 01:50:13,
ubi shall least sell pop bge rayman someone care,0,1hy34r8,https://www.reddit.com/r/ubisoft/comments/1hy34r8/ubi_shall_at_least_sell_pop_bge_and_rayman_to/,probably along splinter cell classic forgotten major ip company maybe someone able finish deliver bge graceful state classic ip mentioned edit fix,4,2025-01-10 12:16:37,
love ubisoft,0,1hya4cz,https://www.reddit.com/r/ubisoft/comments/1hya4cz/i_love_ubisoft/,reason hater post personnaly lot hope ac shadow think stop trashing ubisoft game constructive fear say like ubisoft game even though great,181,2025-01-10 17:44:36,
skull bone ubisoft premium trial,0,1hxl5a3,https://www.reddit.com/r/ubisoft/comments/1hxl5a3/skull_and_bones_on_ubisoft_premium_trial_only/,hour trial skull bone ubisoft premium say game included remember playing beta game came believe said game going ubisoft plus,0,2025-01-09 19:36:41,
play ubisoft game,1,1hwztds,https://www.reddit.com/r/ubisoft/comments/1hwztds/cant_play_my_ubisoft_games/,started playing siege lately computer realized using wrong ubisoft account computer connected email longer went close account unlink account ubisoft game link actual account longer play game hoping account fully deleted month start playing hoping anyone quicker solution,0,2025-01-09 00:29:58,
completely remove profile photo ubisoft want custom one,1,1hwxyt9,https://www.reddit.com/r/ubisoft/comments/1hwxyt9/how_to_completely_remove_profile_photo_on_ubisoft/,title,0,2025-01-08 23:12:28,
prince persia game,1,1hw3hnq,https://www.reddit.com/r/ubisoft/comments/1hw3hnq/prince_of_persia_games/,wondering many would like see new prince persia game like warrior within two throne forgotten sand instead platfoming stuff franchise lately oppinion would great prince persia game assassin creed mechanic great story new gen graphic maybe even open world even though know would work view poll,1,2025-01-07 22:07:51,
ac shadow come little month yet ubisoft still let anyone preorder,0,1hw4joq,https://www.reddit.com/r/ubisoft/comments/1hw4joq/ac_shadows_comes_out_a_little_over_a_month_from/,official website preorder game wishlist wtf going ubisoft game literally last saving grace last hail mary save dying company bankruptcy yet seem like want anyone buy although given colossal shitshow game going maybe u favour,75,2025-01-07 22:52:50,
redeeming code game already,1,1hvu9qd,https://www.reddit.com/r/ubisoft/comments/1hvu9qd/redeeming_codes_for_games_i_already_own/,hello casual rainbow six siege player recently friend mine gifted code operator edition since operstors know happen redeem main ubisoft platform find online upgrade version game wondering could something like steam remove game main account redeem one choose edition keep pls tell way want create new account better copy rainbow six,1,2025-01-07 15:45:27,
disable challenge notification ubisoft connect xbox,2,1hvita0,https://www.reddit.com/r/ubisoft/comments/1hvita0/disable_challenges_notification_ubisoft_connect/,series playing avatar unable disable large disturbing annoying pop ups upper right corner completing challenge far cry assassin creed game could disable although exactly recall uninstalled ubisoft connect app xbox game appears secret intrusive ubisoft connect layer included get rid popup notification,1,2025-01-07 03:58:40,
many day expected get reply ubisoft customer service,1,1hvi9ql,https://www.reddit.com/r/ubisoft/comments/1hvi9ql/how_many_days_should_be_expected_to_get_a_reply/,submitted case almost th day response ubisoft normal,11,2025-01-07 03:29:58,
ubisoft refused transfer,0,1hvek8c,https://www.reddit.com/r/ubisoft/comments/1hvek8c/ubisoft_refused_transfer/,basically spent entire day showing proof purchase recovering account could transfer game gaul say outside rule transfer literally said want stringing along day,9,2025-01-07 00:28:31,
fa question,8,1humm2p,https://www.reddit.com/r/ubisoft/comments/1humm2p/2fa_questions/,hi recently got email ubisoft yes checked actually ubisoft saying account logged brazil live europe obviously changed password using link mail site hope safe however got account fa turned receive email text anywhere get account without using fa,15,2025-01-06 00:58:02,
fractured whole steam season pas work,3,1hu5l5d,https://www.reddit.com/r/ubisoft/comments/1hu5l5d/fractured_but_whole_steam_season_pass_doesnt_work/,spare casual solution please since day ubisoft install dlcs correctly yes activated yes bought steam main game season pas yes reinstalled everything multiple time various variation dlcs activated activated activated afterward etc yes flushed config every necessary step enter game season pas activation window appeared never click dlcs brings steam store say stuff library ingame receive anything box bus station thing prompted buy even though steam store obviously since library anyone ever solution please help,1,2025-01-05 11:57:23,
explain ubi alive,0,1hueyky,https://www.reddit.com/r/ubisoft/comments/1hueyky/explain_to_me_how_ubi_is_alive/,joke serious company would go bankruptcy fails release close down studio managing stay afloat money come really understand alive strategy survive fav game division bad management kind killed game massive entertainment great,15,2025-01-05 19:28:19,
next ubisoft sale steam,0,1hu3op5,https://www.reddit.com/r/ubisoft/comments/1hu3op5/next_ubisoft_sale_on_steam/,away christmas new year missed huge ubisoft sale wanted pick farcrys assassin creed anyone know likely go sale,10,2025-01-05 10:06:43,
anyone know ubi conect app next work,2,1htnij8,https://www.reddit.com/r/ubisoft/comments/1htnij8/anyone_know_when_the_ubi_conect_app_will_next_work/,trying play mate sure app work friend xbox anyone know downtime cheer,4,2025-01-04 20:26:29,
play ac ezio collection ac remastered p via physical disc without internet,1,1htrtga,https://www.reddit.com/r/ubisoft/comments/1htrtga/can_i_play_the_ac_ezio_collection_and_ac_3/,title say prepping company go longer exists please mod saying hate adore game pc copy require certain always online drm console version require iv read added console last year thank advance get read,6,2025-01-04 23:39:36,
shadow collector edition pc,1,1htjzjj,https://www.reddit.com/r/ubisoft/comments/1htjzjj/shadows_collectors_edition_pc/,anyone know pc come steel case code redeem ubisoft launcher would assume latter would love still steelcase even contains code,0,2025-01-04 17:53:42,
game missing library,3,1ht78km,https://www.reddit.com/r/ubisoft/comments/1ht78km/games_missing_from_library/,aware ubisoft took away ability download ac original library replaced acr swear owned hawx library see gone took away title download library,4,2025-01-04 05:17:50,
run acii outside app saving stats,1,1hswxlv,https://www.reddit.com/r/ubisoft/comments/1hswxlv/cant_run_acii_from_outside_the_app_and_its_saving/,bought acii installed every time try run desktop shortcut give need activation code run inside ubisoft connect problem run saving stats account trophy playtime,0,2025-01-03 21:01:29,
shadow collector edition preorders,1,1hsrvqg,https://www.reddit.com/r/ubisoft/comments/1hsrvqg/shadows_collectors_edition_preorders/,sure people aware thought ild let people know made preorder ac shadow collector edition back may via gamecom websit later year around october found gamecom actually cancelled order devastated love ac franchise game store licence sell collector edition uk fast forward christmas scrolling sport direct app found still version still availablexboxpspc atm january sale deal lowered priced includes shipping fee planing buy ebay like save self money look sport direct edit look like pc version went stock,12,2025-01-03 17:31:17,
get ubisoft content xcloud read,1,1hspxsa,https://www.reddit.com/r/ubisoft/comments/1hspxsa/cant_get_your_ubisoft_content_on_xcloud_read_here/,figured work around link xbox ubisoft account side link ubisoftcom account ubisoft store page xboxcom go game xcloud select item store see store page option get ubisoft click sign microsoftcom receive access ubisoft subscription content happy new year,0,2025-01-03 16:10:37,
truly hope ubi turn around year,86,1hrqb75,https://www.reddit.com/r/ubisoft/comments/1hrqb75/i_truly_hope_ubi_turns_it_around_this_year/,ubisoft used time favorite video game company making time favorite game splinter cell ac day still think game still favorite made childhoodteenage year really shame went downwards spiral point hoping,98,2025-01-02 09:50:01,
tencent buy ubi,0,1hs4lh4,https://www.reddit.com/r/ubisoft/comments/1hs4lh4/if_tencent_buys_ubi/,mean game franchise game part company tencent bought improved quality way familiar china video game trend gacha mtx crap outta game basically know ubi game already mtx beyond dumb single player game feat get worse,41,2025-01-02 21:12:07,
way play ubisoft game pc,0,1hrubgt,https://www.reddit.com/r/ubisoft/comments/1hrubgt/other_ways_to_play_ubisoft_games_on_pc/,would like play first watch dog fps bought steam idea log account app whatever called activate game rediculous given account thing long ago also sub rule even allow asking problem try start game want open log app able get account year ubisoft help never replied email site nothing help new account work ubisoft nothing p still work watch dog version support fps far know question way bypass log account pc anyone another idea know way play piracy edit suggested comment connecting new ubisoft account steam worked game stared problem verify email address new account getting email,11,2025-01-02 14:00:48,
trouble siege,2,1hr91bp,https://www.reddit.com/r/ubisoft/comments/1hr91bp/having_trouble_with_siege/,first bought booted siege know ubisoft already logged brother account couple month ago defaulted account went log log back said something along line log authorized keep saying frustrating since literally bought game play siege like,4,2025-01-01 18:32:02,
wrote plot entire ac game concept even submit,0,1hrgyit,https://www.reddit.com/r/ubisoft/comments/1hrgyit/i_wrote_the_plot_for_an_entire_ac_game_concept/,spent literal week writing ac game idea went submit found policy restrict submission copypaste plot feel free critique prologue protagonist german boy named bernhard fischer seen year old year main story potsdam germany bernhard father albrecht owes large unpaid debt templar debtor debtor named leopold ller order men execute bernhard mother chop arm shoulder father forced watch lead bernhard father state deep depression alcoholism eventually leading abusive behavior toward year timeskip one night albrecht drunkenly attack bernhard intoxicated anger tripped falling onto blade people near house heard commotion went investigate last drunken breath albrecht blamed wound son bernhard set hanged next morning think plan survive sneak father dagger rear waist pant saving later use gallows us blade cut rope wrist narrowly escaping police bernhard fled city taking refuge berlin timeskip main story bernhard meet dentist named peter baliff invented prosthetic arm controlled using leather strap transmit tension shoulder girdle prosthetic delighted new arm bernhard venture street discovers hooded man fleeing local police strange blade like contraption wrist interested follows man hideout caught questioned explains intrigued blade mechanism wanted learn find friend adelmo schneider hooded man saw notice adelmo asking explanation people told brotherhood told templar order legendary master assassin alta ibnla ahad ezio auditore da firenze completing set trial initiated brotherhood granted rank recruit along unique hidden blade built prosthetic arm told current leader templar order frederick william king prussia templar order hungry power infiltrating position authority throughout germany following event bernhard given first assignment hunt templar leader target named anton richter head multiple templar den district hunt anton causing collapse multiple den across district first assignment given brotherhood robe month timeskip bernhard granted rank assassin become infamous region already receives anonymous letter simple instruction find leipzig travel leipzig meet napoleon bonaparte reveals letter sent napoleon wanted ask favor bernhard army severely weakened battle leipzig napoleon needed help bernhard decides help although particularly agree napoleon political choice realizes ally high place come benifits help friend gerald sch fer begin rallying recruiting new troop napoleon one day attempt convincing man join napoleon attacked gerard killed bernhard fight attacker clueless happening panicking outnumbered bernhard retreat hideout bernhard cautiously go back street get pistol upgrade arsenal bernhard better prepared go back attacked search sign may come gone follows track back hideout wait someone come man leaf hideout bernhard tail alleyway try rob old couple bernhard intervenes take man back brotherhood hideout questioning man appears mute though communicated hand signal bernhard get fed threatening man pistol tell speak write man terrified writes part cult called celestials believe wrongdoing source peace along location den throughout berlin adelmo ranked advanced assassin shotcaller brotherhood arranges several attack celestial cult den bernhard participates attack destroying cult entirely bernhard recieves letter uncle wilhelm stein telling sick important message relay bernhard bernhard trust adelmo able keep berlin control travel cottbus visit uncle wilhelm upon arrival meet immediately wilhelm tell past family never met talk creed run family bernhard distantly related ezio auditore hence presence eagle vision wilhelm pass peacefully bernhard care cottbus templar lead attack district bernhard visiting bernhard run battle instantly eventually overpowered templar knocked platform getting knocked unconcious templar believing killed threw pile body burned wake attack surrounded templar manages sneak away burning area mount horse return berlin return berlin find adelmo surrounded templar near trading post help adelmo fight enemy return hideout adelmo tell getting close finding piece eden templar order tail bernhard tell give information stay within hideout adelmo tell form weapon weilded powerful figure germany bernhard mission discover piece eden keep templar hand bernhard infiltrates multiple government territory slowly retrieving information discovers piece eden form mace made england bernhard take london find creator london bernhard discovers mace made man named charles marley interrogates charles asks sold mace bernhard told gave men threatened making told ask question charles provides description men gave mace allowing bernhard identify bernhard identifies men english templar hunt one one upon finding bernhard interrogates eventually finding king germany frederick william mace eden next month bernhard infiltrates government territory gaining information william ally killing bernhard weakens military strength area get opportunity finish new vulnerability raise higher vigilant security force around time take adelmo along recruit assist fight attack convoy transporting frederick killing guard quickly bernhard tell group stay back let finish job approach carriage transporting frederick hidden blade extended begin open door hears rustling inside react frederick burst door knocking ground instantly one guard entirely finished sneak behind adelmo one swordstroke get adelmo knee slit throat cut assassin second later frederick attempt flee holding mace eden mace appears healed illness bernhard chase across city follows brandenburg gate fight hand hand frederick trying pull sword finish job frederick swing bernhard forcing raise guard misdirect blow sword snap half leaving nearly defenseless bernhard reach gun frederick fire strange beam energy bernhard knocking pistol hand ending bernhard know sword broken two gun side gate spirit adelmo beside frederick william opposing weilding mace eden know nothing kill king charge frederick hidden blade extended swing arm frederick neck barely missing reach pistol forgetting thrown side tower frederick raise mace fire beam energy towards bernhard bernhard duck behind bit rubble planning next move frederick approach bernhard mace still hand except time bernhard ready faster frederick physically mentally wait frederick get closer plan next move frederick approach wreckage bernhard swiftly charge tackling gate frederick panic mace fall grasp rapidly falling top brandenburg gate bernhard push frederick away land safely wagon full hay bernhard get wagon pick mace hand mentor going home potsdam end cutscene bernhard assassin left see frederick escape severely wounded,12,2025-01-02 00:29:42,
ubi game bought steam save setting,0,1hrawpv,https://www.reddit.com/r/ubisoft/comments/1hrawpv/ubi_games_bought_on_steam_dont_save_settings/,hi ever since ubi decided finally add achievement steam bought far cry since like however change setting anyone else encounter found way resolve,4,2025-01-01 19:53:16,
ac revelation pc stutter,1,1hr6uw7,https://www.reddit.com/r/ubisoft/comments/1hr6uw7/ac_revelations_pc_stutter_2025/,wanted make note looking way get around stutter ac revelation steam systemdetectiondll file acrevelationsini file mess running win rtx ikf turned vsync game seemed work hopefully others trying play game higher specd pc experiencing similar issue result,0,2025-01-01 16:54:40,
outlaw question,3,1hq8x69,https://www.reddit.com/r/ubisoft/comments/1hq8x69/outlaws_question/,title update earlier dec major concernes actually addressed made game worth getting like star war crazy know sorry anyone played launch version stuck day offer comparissons thanks,0,2024-12-31 06:37:32,
black flag ubisoft server,2,1hq684b,https://www.reddit.com/r/ubisoft/comments/1hq684b/black_flag_ubisoft_servers/,replay week send ship thing cabin worked fine day ago december part say server searched net ubisoft website see anything looked server retirement plan black flag see wiiu retirement earlier year play xbox series anyone know heard anything,0,2024-12-31 04:00:05,
yasuke ancestor,2,1hph5u6,https://v.redd.it/mscnf6pblx9e1,bruthahood,1,2024-12-30 06:37:11,
wrong language south park stick truth,3,1hoyjx9,https://www.reddit.com/r/ubisoft/comments/1hoyjx9/wrong_language_south_park_the_stick_of_truth/,title store french game english,3,2024-12-29 15:42:40,
ac odyssey v colourblindness tip support,1,1hozcc2,https://www.reddit.com/r/ubisoft/comments/1hozcc2/ac_odyssey_vs_colourblindness_tips_or_support/,deut type colourblind red mostly everything ac shade red orange mean often see tell difference attack telegraphing ie red sand background see lethal attack prompt time tell difference white orange attack prompt searched option colour customisation would love make prompt purple light blue see easily blend game background find anything exist looking wrong place work around increased nvidia colour setting digital vibrance using window colourblind mode deuteranopia using geforce experience colourblindness filter intensity deuteranopia unfortunately still finding difficult see difference lethal attack prompt background shade similar anything else maybe shift hue slightly nvidia tried yet played around setting bunch find following setting work best window colourblind mode deuteranopia nvidia digital vibrance monitor nvidia game filter sharpen intensity texture detail brightnesscontrast exposure contrast highlight shadow gamma bare mind colourblindness quite specific may need variation setting able see prompt clearly find worst battle whent red particle physx air option found survive scenario change hue nvidia making red blue still really hard distinguish far realistic make playable fo rme managed complete battle setting make sure turn colour blind filter using option though colour graduation also highlight much red palette used game really red still interested official support available,0,2024-12-29 16:19:29,
reuse legacy username,1,1hp2sel,https://www.reddit.com/r/ubisoft/comments/1hp2sel/can_i_reuse_my_legacy_username_again/,title say allowed reuse legacy username changed username,0,2024-12-29 18:51:03,
fast travel ac odyssey,2,1hosyec,https://www.reddit.com/r/ubisoft/comments/1hosyec/cant_fast_travel_in_ac_odyssey/,dad playing ac odyssey told fast travel icon green tap fast travel text grey restricted area fight something bug solve,4,2024-12-29 09:59:17,
