Title,Upvotes,Post ID,URL,Text,Comment Count,Posted Date,sentiment
little thing shadow make big difference,510,1jfuu9s,https://www.reddit.com/r/assassinscreed/comments/1jfuu9s/little_things_in_shadows_that_make_a_big/,number thing big story graphic make love game even progression system far feel excellent way introduce mechanic game perfect overwhelming time slow right gear look fantastic seeing game able inspect detail character menu look amazing really cool gear tool actually physically attached character feel really grounded reality thing minigames actually feel good like meditation game naoe actually kind feel like meditating close eye press button prompt based timing sound alone painting one also really cool simple feel really good reason able inspect hang drawing hideout really cherry top music phenomenal amazed sound music design wishlist game knocked park guess little thing immersive mode perfect japanese voice acting sound spot prop phoning actually quality voice actor ton thing immediately come mind course story graphic gameplay excellent bigger discussion,105,2025-03-20 17:48:02,
anyone know way uncover map fog shadow riding spot specifically,13,1jggvsb,https://www.reddit.com/r/assassinscreed/comments/1jggvsb/anyone_know_a_way_to_uncover_the_map_fog_in/,like origin example would discover region area would map,24,2025-03-21 13:31:30,
question shadow main story playing yasuke mild spoiler,2,1jgusn3,https://www.reddit.com/r/assassinscreed/comments/1jgusn3/question_on_shadows_main_story_and_playing_with/,based trophy saw main story divided prologue three act epilogue finished prologue currently quest naoe precisely created forge hideout tracking first figure league shadow get play yasuke okay go bad guy see story flow missed something play yet yasuke,4,2025-03-21 23:31:24,
skip logo starting ac shadow delete file,1298,1jfnk1u,https://i.redd.it/qnvrb0167upe1.png,steam located main drivesteamlibrarysteamappscommonassassins creed shadowsvideos file located subfolder video folder based language playing play english folder en would start game least delete file deleting file save second would say,55,2025-03-20 12:18:55,
opinion yasuke ranged weapon slot,5,1jglw2c,https://www.reddit.com/r/assassinscreed/comments/1jglw2c/opinion_yasuke_should_have_a_ranged_weapon_slot/,unlocked yasuke surprised ranged weapon slot instead player sacrifice one melee weapon personally feel would better slot available know loadouts thing player never really know going need exact moment swapping back forth silly example need explode jar running purely melee build making separate ranged slot would also less headache making build number main weapon yasuke would drop amount naoe remove need switch loadouts completely change weapon thought,1,2025-03-21 17:08:44,
gain knowledge rank point ac shadow,1,1jgyend,https://www.reddit.com/r/assassinscreed/comments/1jgyend/how_to_gain_knowledge_ranks_not_points_in_ac/,gained used many knowledge point ac shadow currently unused still stuck knowledge rank say next rank seens knowledge point bottom left screen stuck halfway unsure whether bug missing something tutorial quite silly talk gaining knowledge point increase knowledge rank,15,2025-03-22 02:32:11,
uncover fog map,2,1jgtppy,https://www.reddit.com/r/assassinscreed/comments/1jgtppy/how_do_you_uncover_all_the_fog_off_the_map/,assumed would unfog got viewpoint region,1,2025-03-21 22:42:22,
upscale past percent like odyssey,6,1jgkrm0,https://www.reddit.com/r/assassinscreed/comments/1jgkrm0/why_cant_we_upscale_past_100_percent_like_in/,game look great get wrong issue naoes hair incredibly blurry feel like tried everything hair setting native aa sharpen etc etc noticed ability go percent resolution scale like odyssey,2,2025-03-21 16:21:54,
ac shadow create loadouts building gallery,5,1jgm6yl,https://www.reddit.com/r/assassinscreed/comments/1jgm6yl/ac_shadows_how_can_i_create_loadouts_after/,unlocked built gallery hideout game say access loadout inventory menu however find option save loadout help,12,2025-03-21 17:20:59,
movement shadow amazing improvement feel great,267,1jfxkuu,https://www.reddit.com/r/assassinscreed/comments/1jfxkuu/the_movement_in_shadows_is_an_amazing_improvement/,parkour obviously still nothing compared older game moving around naoe traversing rooftop feel much fluid rpg genuinely think feel way better mirage hopefully introduce better back side ejects think easily best movement system last year sadly city dense baghdad use,68,2025-03-20 19:40:54,
lost legendary tanto engraving,8,1jgibf1,https://www.reddit.com/r/assassinscreed/comments/1jgibf1/i_just_lost_a_legendary_tanto_by_engraving_it/,shinobis furry tanto level loved disapeared try engrave armor pen anyone else experienced somehow stash checked really look like got destroyed somehow still visuals inventory equipment disappeared noticed tried double assassinate could tried swap tanto exist anymore,5,2025-03-21 14:37:19,
small fighting group road,1,1jgxn4k,https://www.reddit.com/r/assassinscreed/comments/1jgxn4k/small_fighting_groups_by_road/,must missed something small group people fighting along roadway killed side people really get one supposed kill mattered,2,2025-03-22 01:51:51,
connect rewardsweekly challanges shadow,17,1jge8np,https://www.reddit.com/r/assassinscreed/comments/1jge8np/no_connect_rewardsweekly_challanges_for_shadows/,quite surprised saw reward weekly challenge shadow ubi connect maybe add later day maybe scrapped expecting weekly challenge would provided progression point animus hub project,25,2025-03-21 11:05:04,
ac shadow use forge,2,1jgsrv7,https://www.reddit.com/r/assassinscreed/comments/1jgsrv7/ac_shadows_how_do_you_use_the_forge/,understand got heiji bought forge interact anything even find heiji literally cutscene accidentally placed engawa tile made forge destroyed tf heiji say upgrade item level gear planting damn forge please help might glitched last manual save hour ago backtrack,18,2025-03-21 21:59:57,
true igan mission stealth,1,1jgx4iq,https://www.reddit.com/r/assassinscreed/comments/1jgx4iq/a_true_igan_mission_100_stealth/,curious one accomplished trying attempt laid fort design using hook tree hard hell almost impossible without spotted looked youtube saw interesting choice lol loving game sure got jank open world stuff heck ac game expect glad world much better valhalla,1,2025-03-22 01:25:15,
absolutely loving shadow far hate modernday music add one particular scene,16,1jgd92i,https://www.reddit.com/r/assassinscreed/comments/1jgd92i/absolutely_loving_shadows_so_far_but_i_hate_the/,one small part early bad larger scene hour game ambush soldier soundtrack go full modernday music totally taking atmosphere lovingly created elsewhere ruin moment otherwise hour behind far describe one word epic,75,2025-03-21 09:58:56,
legendary weapon gone missing slight spoiler,6,1jgjfhs,https://www.reddit.com/r/assassinscreed/comments/1jgjfhs/legendary_weapon_gone_missing_slight_spoilers/,found legendary tanto cave st quest drink yasuke gone might disappeared earlier think,41,2025-03-21 15:25:50,
torchtorch equivalent assassin creed shadow,3,1jgoefv,https://www.reddit.com/r/assassinscreed/comments/1jgoefv/is_there_a_torchtorch_equivalent_in_assassins/,love game torch light dark area exploring like previous game seem like unless missing something playing naoe since sleep forward time torch would great since choice play night sometimes,14,2025-03-21 18:52:27,
spoiler possible family theory shadow,0,1jgwe9y,https://www.reddit.com/r/assassinscreed/comments/1jgwe9y/spoiler_possible_family_theory_in_shadows/,two hour game love far would wild naoe mother kassandra know mysterious mention mother figure made immediately jump mean alive somewhere shadow one thought would love hear people suspicion please spoil already gotten far,12,2025-03-22 00:48:38,
thought animus hub launcher,1,1jgwdug,https://www.reddit.com/r/assassinscreed/comments/1jgwdug/thoughts_on_the_animus_hub_launcher/,hour shadow game incredible really dumbfounded way new animus hub launcher game even decide launch one game outside shadow shuts shadow app load game app effectively locked returning launcher point seems like incredible waste time resource ubisofts part,8,2025-03-22 00:48:01,
purpose dagger mirage,1,1jgw1er,https://www.reddit.com/r/assassinscreed/comments/1jgw1er/what_is_purpose_of_daggers_in_mirage/,see description hlwhem dagger used equip certain time please tell codex explains feel dumb find,2,2025-03-22 00:30:44,
assassin creed shadow might tenchu spiritual successor waiting,4,1jgjosh,https://www.thepopverse.com/gaming-assassins-creed-shadows-tenchu-stealth-assassins-comparison-essay,assassin creed shadow finally available hard think series past potential future moreover feudal japan setting prompted number comparison recent game closest relative could dormant tenchu series roughly year since tenchu shadow assassin landed wii psp failed wow gamers experienced alta ibnla ahad first adventure beefier console hardware even though assassin creed born scrapped prince persia project kept premise organized assassin historical setting alive took next level old ubisoft dna crystalclear anyone spent time developerpublisher psera effort formula evolution year moved closer away ip somehow spite central premise series assassin creed set japan focusing infamous shinobi samurai took decade definitely come together concept ubisoft wanted tackle next fastforward ready jump late sengoku period naoe yasuke allnew stealth system added top setting land right next tenchu explored back day finally getting modern descendant would waiting read assassin creed shadow might tenchu spiritual successor waiting popverse,1,2025-03-21 15:36:51,
ocd shadow best way enjoy game,0,1jgv0hp,https://www.reddit.com/r/assassinscreed/comments/1jgv0hp/ocd_in_shadows_best_way_to_enjoy_the_game/,hey moment every map marker quest question mark etc map hour wondering perhaps would enjoy game quest objective menu skipped random question mark eagle symbol map however question mark turned cool side content want skip something interesting approach game,11,2025-03-21 23:41:47,
love shadow far could use adjustment longer cut scene fight sequence,2,1jgpwlf,https://www.reddit.com/r/assassinscreed/comments/1jgpwlf/i_love_shadows_so_far_but_it_could_use_some/,thing gotten frustrated far repeat long sequence due death admit swapping crouchdodge button release led silly death since remapped realizing caused issue big deal part found though sometimes longer cut scene make redo always skip comparatively feel like valhalla autosaving lot shadow redo minute sequence like really autosave middle situation manually save either crash bug last night repeat bunch stuff well tldr would love autosaves cutscenes,0,2025-03-21 19:55:39,
gripe game far spoiler,4,1jgkde0,https://www.reddit.com/r/assassinscreed/comments/1jgkde0/my_only_gripe_with_the_game_so_far_spoilers/,played much game played loving however one thing really got ac mythological overarching narrative dealt isu felt like origin odyssey excellent term managed aspect series also appreciate game past interwoven part lore undertone rather forefront like game mentioned like ac conspiracy stuff tied piece eden one favorite thing artifact could essentially use gear game series odyssey valhalla kind oversaturated still cool opinion even syndicate unity aegis sword eden isu armor black flag ring eden connor understand decided complete shadow excited see asian isu would like since one seen european least game wondering relegated isu game coming future know director said interview wanted scale back make sure good handle lore anything else basim modern day crew suck others share sentiment wait may never get japanese kami,23,2025-03-21 16:05:29,
ac switch shoulder left right possible,4,1jgi880,https://www.reddit.com/r/assassinscreed/comments/1jgi880/ac_s_switch_shoulders_from_left_to_right_possible/,switch left right shoulder ac shadow pc center like valhalla really like leftcentering character,1,2025-03-21 14:33:18,
cinematography ingame cut scene improved,33,1jg8n6s,https://www.reddit.com/r/assassinscreed/comments/1jg8n6s/cinematography_in_ingame_cut_scenes_improved/,playing shadow hour say one best thing game compared recent trilogy ac game massively improved cutscenes overall cinematography angle use previously last year ac would locked pretty standard conversation character much moving around thing pretty dynamic,1,2025-03-21 04:24:58,
reason hideout forced fps,137,1jfyj22,https://www.reddit.com/r/assassinscreed/comments/1jfyj22/is_there_a_reason_the_hideout_is_forced_30fps/,loving game far damn jarring going hideout going fps fps discernable reason way set,96,2025-03-20 20:19:49,
romance work shadow,6,1jggbgh,https://www.reddit.com/r/assassinscreed/comments/1jggbgh/how_do_romances_work_in_shadows/,choose canon mode play game first time tomorrow however looking forward romance want know miss romance work shadow like odyssey like valhalla could start longterm relationship inhabitant hideout moreover would like nobody talked story played game yet,10,2025-03-21 13:03:42,
anyone know start shadow project,16,1jgb6iu,https://www.reddit.com/r/assassinscreed/comments/1jgb6iu/anyone_know_how_to_start_the_shadow_projects/,okay started game hour life figure activate find something anomaly find story locked tell tried post earlier post never went,13,2025-03-21 07:19:54,
throw kunai nearest enemy assassination,27,1jg8iw1,https://www.reddit.com/r/assassinscreed/comments/1jg8iw1/throw_kunai_at_nearest_enemy_after_assassination/,anyone guide actually work buggy seems pick choose want work always got kunai always equipped etc refuse throw sometimes others throw speed efficiency train figure,35,2025-03-21 04:17:49,
dual pack level,0,1jgxq81,https://www.reddit.com/r/assassinscreed/comments/1jgxq81/do_the_dual_packs_level_up_with_me/,wondering dual pack buy store level character since go buy show gear current level basically bought gear level,6,2025-03-22 01:56:21,
favorite weapon faryasuke naoe,3,1jgk8m4,https://www.reddit.com/r/assassinscreed/comments/1jgk8m4/favorite_weapons_so_faryasuke_and_naoe/,far loving kusarigama op armored enemy give satisfaction able take multiple enemy gotten ysauke based actually find teppo interesting naginata since mentioned game course never thought teppo would interesting mostly gun ac niceexcept guillotine one,23,2025-03-21 16:00:12,
ac shadow require ubisoft connect steam,0,1jgx4mb,https://www.reddit.com/r/assassinscreed/comments/1jgx4mb/does_ac_shadows_require_ubisoft_connect_on_steam/,one open game steam open ubisoft connect play normal game need stupid ubisoft connect thing,2,2025-03-22 01:25:24,
thought shadow hour minor spoiler,104,1jfxzt0,https://www.reddit.com/r/assassinscreed/comments/1jfxzt0/thoughts_on_shadows_5_hours_in_minor_spoilers/,let u get obvious way game graphically beautiful p pro rtgi along fps make game look amazing combat wise far feel like best modern ac game way always thought rpg game great combat feel smoothest naoe definitely combat character carry get overwhelmed quickly since take kill enemy say much stealth since playing normal know expert difficulty stealth way go naoe voice acting fine hate definitely favorite say much character yet since story starting technically story far intriguing event set naoe journey intrigued see yasuke role play loot massive improvement odyssey since provide bonus stats dictate play style massively like odyssey plus already found black beaked hood soundtrack far great kind worried teketeke portion ost would ruin vibe anything one appeared enhanced moment lastly would take bullet junjiro,99,2025-03-20 19:58:23,
ac shadow disable skillassassination black white filter,18,1jg9kx0,https://www.reddit.com/r/assassinscreed/comments/1jg9kx0/ac_shadows_disable_skillassassination_black_and/,remember people saying way toggle black white paper filter killing using skill anyone know option kind distracting combat,3,2025-03-21 05:24:32,
kind disappointed lack side quest game,5,1jggrl6,https://www.reddit.com/r/assassinscreed/comments/1jggrl6/kinda_disappointed_with_the_lack_of_side_quests/,hyped heard director odyssey shadow loved side quest odyssey since kind plot twist good story tell shadow lack sidequest playing hour sidequests basically collect item npc kill bandit xy area spawn tree objective menu kill like people cult kind sad short sidequest one good short story twist end citiesvillages even one single sidequest,28,2025-03-21 13:25:56,
ac shadow fix mistake made story spoiler,0,1jgr9k2,https://www.reddit.com/r/assassinscreed/comments/1jgr9k2/ac_shadows_can_i_fix_a_mistake_i_made_during/,hi think made little mistake playing story bit today someone maybe advice something act spoiler made choice recruit yaya found later ally use game possible recruit turned,1,2025-03-21 20:53:37,
way play old ac multiplayer,1,1jgqs3g,https://www.reddit.com/r/assassinscreed/comments/1jgqs3g/is_there_any_way_to_play_the_old_ac_multiplayer/,curious still work fanmade version may know replaying old game bummed thinking multiplayer,2,2025-03-21 20:32:46,
ac shadow play expert immersive mode tip,421,1jfmxfu,https://www.reddit.com/r/assassinscreed/comments/1jfmxfu/ac_shadows_play_on_expert_and_immersive_mode_and/,played bit shadow tip guy make game enjoyable possible play expert mainly stealth stealth game heavily improved fact willing say par unity tied best stealth series one important thing play expert add whole new layer complexity game enemy fave vertical vision cone well meaning reign supreme rooftop anymore yes guard look see lot kore realistic challenging play guided mode game exploration mode basically pointless wasting good scout reveal exact location guided mode location revealed basically reducing grind saving money time ti wait season change replenish scout immersive mode goat seriously stress enough japanese voice acting par game like yakuza way better english favor trust explore knowledge point important aspect game way become stronger get better fun skill plus get amazing story bead meditation mini game naoe quick take advantage easily take dozen enemy one smoke bomb gather enemy one place bell throw smoke assassinate hideout important get tn benefit engraving legendary perk xp scout say hope help bit make game fun,136,2025-03-20 11:42:39,
thought weapon shadow far combo use,5,1jgfou5,https://www.reddit.com/r/assassinscreed/comments/1jgfou5/your_thoughts_on_the_weapons_in_shadows_so_far/,grain salt third knowledge row sure endgame shake thing bit naoe katana versatile probably best dueling weapon look cool hell moved away tanto primary purely double assassination live without fight much auto dodge ability busted hidden hand ability going make bust unlock play guaranteed assassination kusarigama good duel katana secondary made moment forced fight crowd much manageable area denial weapon provides heavy posture attack insane one get near trapped building even wreck nearby destructible object chance room fight yasuke long katana bread butter use time work well almost every situation naginata secondary almost always unless switch ranged weapon niche situation time swap naoe call similar kusarigama area denial weapon thing getting spicy extra range sweeping attack really help thin large crowd kanabo used min decided slow yasuke beast begin extra oomph long wind ups felt unnecessary teppo honestly see use case besides blowing barrel slow getting much use fight loud nonviable stealth option well bow go ranged weapon absolutely need one time going walk start mauling people yasuke discrete approach bow would required better switching naoe anyway,24,2025-03-21 12:30:52,
many small piece dialogue without subtitle,27,1jg64f3,https://www.reddit.com/r/assassinscreed/comments/1jg64f3/so_many_small_pieces_of_dialogue_without_subtitles/,playing game immersive mode great far one problem understand guard common people world talking subtitle conversation related side quest apparently,15,2025-03-21 02:05:54,
stuck choose canon mode,0,1jgprgi,https://www.reddit.com/r/assassinscreed/comments/1jgprgi/ive_been_stuck_on_if_i_should_choose_canon_mode/,ac shadow spoiler honestly idea pick sitting minute debating choose love assassin creed linear story also really enjoy rpg side assassin creed making decision hit conundrum pick,16,2025-03-21 19:49:47,
ac shadow animation combat gear accessibility,1,1jgpaun,https://www.reddit.com/r/assassinscreed/comments/1jgpaun/ac_shadows_animations_combat_and_gear/,animation combat enjoying game far combat feel heavier consequential previous title love soulsborn soulslike veteran wish yasuke flashier swing finisher ultra flashy like naoes also wish kill animation assassination jumpingfalling attack whack running attack whack feel silly kick armored man ft struggle pull ledge get ithe heavybut also great physical condition sprint look weird left arm kind flailing right remains relatively close side anyone else noticed enterexit haystack one direction nearly got killed trying exit opposite side mid battle gear accessibility feel like downgrade compared ac origin last title fully played origin melee weapon least ranged readily available switch midgame seemless transition shadow pause switch weapon slot ranged weapon slot addition melee need slot horse lol also miss mixmatching gear visible upgrade like unitythe devs could put money hour customizing character gear rather decorating base mainly play rpgs opinion nothing short biased,2,2025-03-21 19:30:25,
ac shadow objective module option difference possibly hide till need also resize compass p,8,1jgcf0v,https://www.reddit.com/r/assassinscreed/comments/1jgcf0v/ac_shadows_objective_module_options_and_their/,pretty much title say enjoying shadow made immersive possible compass sleek design sizing massive everything resized missing option compass want slightly smaller main point objective module multiple option dynamic manual know beyond well want option hide always cover screen much however want able say tap left something show objective want accidently miss something forgot check map update thing exist also know left button even beyond line objective never use say tap give hint objective nothing know,11,2025-03-21 08:56:02,
confused dual protagonist new game,1,1jgjtyq,https://www.reddit.com/r/assassinscreed/comments/1jgjtyq/for_those_confused_about_the_dual_protagonists_in/,yes change character like able syndicate noticed lot confusion make think lot player fell pretty much black flag decided return game syndicate closest modern time far game also dual protagonist frye twin one female one male evie stealth oriented one jacob aggressive combat driven evie repeating dual protagonist thing possible experiement see people like mostly see confusion misunderstanding point allow player freedom choice instead locking one character origin meant played ayas pov bayek scrapped together along change narrative due numerous complaint play girl time even given choice playing guy girl odyssey valhalla saw twitch said chose boy fit narrativestory better odyssey despite kassandra cannon well others outright saying think girl apart game watch many people play valhalla sure result personally play kassandra female eivor game tired male role game wanted something different also chose kassandra due cannon well chose female eivor solely due exhaustion playing male role follow align misogynistfeminist stuff either,29,2025-03-21 15:43:05,
ac shadow ever get pssr,0,1jgp5ro,https://www.reddit.com/r/assassinscreed/comments/1jgp5ro/will_ac_shadows_ever_get_pssr/,come understand p pro support pssr considering visually stunning game already imagine much pssr enhance graphical appeal,3,2025-03-21 19:24:26,
